{
  "schema_version": "1.0.0",
  "document_id": "commercial_catalog_00002",
  "domain": "commercial_catalog",
  "source_engine": "playwright_html",
  "bbox_convention": {
    "origin": "top-left",
    "units": "pt",
    "dpi_for_px_assets": 150,
    "box_type": "content"
  },
  "generation_seed": 4200002,
  "pages": [
    {
      "page_number": 1,
      "dimensions_pt": [
        612.0,
        792.0
      ],
      "dimensions_px": [
        1275,
        1650
      ],
      "image_path": "output/commercial_catalog/images/commercial_catalog_00002_p1.png",
      "layout_elements": [
        {
          "element_id": "cc00002_p1_e000",
          "type": "page_header",
          "bbox": [
            36.902544000000006,
            37.362863999999995,
            575.097456,
            49.779636
          ],
          "text": "ELYSIAN\nVOL. 8 / 2026",
          "reading_order": 0,
          "attributes": {
            "is_continued_from": null,
            "is_continued_on_next_page": false
          }
        },
        {
          "element_id": "cc00002_p1_e001",
          "type": "title",
          "bbox": [
            36.9,
            87.6225,
            577.1625,
            110.6625
          ],
          "text": "ELYSIAN / SMART HOME TECH",
          "reading_order": 1,
          "attributes": {
            "is_continued_from": null,
            "is_continued_on_next_page": false
          }
        },
        {
          "element_id": "cc00002_p1_e002",
          "type": "text",
          "bbox": [
            36.9,
            113.5425,
            577.1625,
            123.1425
          ],
          "text": "Curated selection of premium smart home tech for contemporary living.",
          "reading_order": 2,
          "attributes": {
            "is_continued_from": null,
            "is_continued_on_next_page": false
          }
        },
        {
          "element_id": "cc00002_p1_e003",
          "type": "picture",
          "bbox": [
            45.54,
            143.3025,
            196.8225,
            233.5425
          ],
          "text": null,
          "reading_order": 3,
          "attributes": {
            "is_continued_from": null,
            "is_continued_on_next_page": false
          }
        },
        {
          "element_id": "cc00002_p1_e008",
          "type": "picture",
          "bbox": [
            231.3825,
            143.3025,
            382.6725,
            233.5425
          ],
          "text": null,
          "reading_order": 4,
          "attributes": {
            "is_continued_from": null,
            "is_continued_on_next_page": false
          }
        },
        {
          "element_id": "cc00002_p1_e013",
          "type": "picture",
          "bbox": [
            417.2325,
            143.3025,
            568.515,
            233.5425
          ],
          "text": null,
          "reading_order": 5,
          "attributes": {
            "is_continued_from": null,
            "is_continued_on_next_page": false
          }
        },
        {
          "element_id": "cc00002_p1_e004",
          "type": "title",
          "bbox": [
            45.06,
            241.7025,
            197.3025,
            252.93
          ],
          "text": "Nexa Thermostat",
          "reading_order": 6,
          "attributes": {
            "is_continued_from": null,
            "is_continued_on_next_page": false
          }
        },
        {
          "element_id": "cc00002_p1_e009",
          "type": "title",
          "bbox": [
            230.9025,
            241.7025,
            383.1525,
            252.93
          ],
          "text": "SoundSphere Pro",
          "reading_order": 7,
          "attributes": {
            "is_continued_from": null,
            "is_continued_on_next_page": false
          }
        },
        {
          "element_id": "cc00002_p1_e014",
          "type": "title",
          "bbox": [
            416.7525,
            241.7025,
            568.995,
            252.93
          ],
          "text": "AeroGlow Ambient Light",
          "reading_order": 8,
          "attributes": {
            "is_continued_from": null,
            "is_continued_on_next_page": false
          }
        },
        {
          "element_id": "cc00002_p1_e005",
          "type": "text",
          "bbox": [
            45.06,
            256.77,
            197.3025,
            274.23
          ],
          "text": "Sleek temperature controller with AI-driven scheduling and energy tracking.",
          "reading_order": 9,
          "attributes": {
            "is_continued_from": null,
            "is_continued_on_next_page": false
          }
        },
        {
          "element_id": "cc00002_p1_e010",
          "type": "text",
          "bbox": [
            230.9025,
            256.77,
            383.1525,
            285.27
          ],
          "text": "360-degree wireless speaker with spatial audio and acoustic tuning.",
          "reading_order": 10,
          "attributes": {
            "is_continued_from": null,
            "is_continued_on_next_page": false
          }
        },
        {
          "element_id": "cc00002_p1_e015",
          "type": "text",
          "bbox": [
            416.7525,
            256.77,
            568.995,
            274.23
          ],
          "text": "Smart lighting panel with voice control and adaptive color gradients.",
          "reading_order": 11,
          "attributes": {
            "is_continued_from": null,
            "is_continued_on_next_page": false
          }
        },
        {
          "element_id": "cc00002_p1_e006",
          "type": "table",
          "bbox": [
            45.06,
            279.99,
            197.3025,
            313.11
          ],
          "text": "Compatibility\tHomeKit, Alexa\nConnectivity\tWi-Fi, BLE\nPower\t12V DC / USB-C",
          "reading_order": 12,
          "attributes": {
            "cells": [
              {
                "row": 0,
                "col": 0,
                "text": "Compatibility",
                "bbox": [
                  45.06,
                  281.91,
                  113.565,
                  288.39
                ]
              },
              {
                "row": 0,
                "col": 1,
                "text": "HomeKit, Alexa",
                "bbox": [
                  113.565,
                  281.91,
                  197.3025,
                  288.39
                ]
              },
              {
                "row": 1,
                "col": 0,
                "text": "Connectivity",
                "bbox": [
                  45.06,
                  292.71,
                  113.565,
                  299.43
                ]
              },
              {
                "row": 1,
                "col": 1,
                "text": "Wi-Fi, BLE",
                "bbox": [
                  113.565,
                  292.71,
                  197.3025,
                  299.43
                ]
              },
              {
                "row": 2,
                "col": 0,
                "text": "Power",
                "bbox": [
                  45.06,
                  303.75,
                  113.565,
                  310.47
                ]
              },
              {
                "row": 2,
                "col": 1,
                "text": "12V DC / USB-C",
                "bbox": [
                  113.565,
                  303.75,
                  197.3025,
                  310.47
                ]
              }
            ],
            "n_rows": 3,
            "n_cols": 2,
            "is_continued_from": null,
            "is_continued_on_next_page": false
          }
        },
        {
          "element_id": "cc00002_p1_e016",
          "type": "table",
          "bbox": [
            416.7525,
            279.99,
            568.995,
            313.11
          ],
          "text": "Warranty\t2 Years\nConnectivity\tWi-Fi, BLE\nPower\t12V DC / USB-C",
          "reading_order": 13,
          "attributes": {
            "cells": [
              {
                "row": 0,
                "col": 0,
                "text": "Warranty",
                "bbox": [
                  416.7525,
                  281.91,
                  485.2575,
                  288.39
                ]
              },
              {
                "row": 0,
                "col": 1,
                "text": "2 Years",
                "bbox": [
                  485.2575,
                  281.91,
                  568.995,
                  288.39
                ]
              },
              {
                "row": 1,
                "col": 0,
                "text": "Connectivity",
                "bbox": [
                  416.7525,
                  292.71,
                  485.2575,
                  299.43
                ]
              },
              {
                "row": 1,
                "col": 1,
                "text": "Wi-Fi, BLE",
                "bbox": [
                  485.2575,
                  292.71,
                  568.995,
                  299.43
                ]
              },
              {
                "row": 2,
                "col": 0,
                "text": "Power",
                "bbox": [
                  416.7525,
                  303.75,
                  485.2575,
                  310.47
                ]
              },
              {
                "row": 2,
                "col": 1,
                "text": "12V DC / USB-C",
                "bbox": [
                  485.2575,
                  303.75,
                  568.995,
                  310.47
                ]
              }
            ],
            "n_rows": 3,
            "n_cols": 2,
            "is_continued_from": null,
            "is_continued_on_next_page": false
          }
        },
        {